{
  "export_schema_version": "0.1-draft",
  "export_id": "55555555-5555-4555-8555-555555555555",
  "exported_at": "2026-09-14T20:00:02Z",
  "runtime": {
    "runtime_id": "aeon-observation-runtime",
    "runtime_version": "0.1"
  },
  "session": {
    "session_state_version": "0.1-draft",
    "session_id": "OBS-SESSION-001",
    "series_id": "OBS-SERIES-001",
    "participant_id": "PSEUDONYM-001",
    "protocol_id": "pg01-geometric-regularity",
    "state": "FINALIZED",
    "revision": 9,
    "last_event_seq": 8,
    "current_attempt_id": null,
    "current_runtime_epoch_id": "11111111-1111-4111-8111-111111111111",
    "created_at": "2026-09-14T20:00:00Z",
    "started_at": "2026-09-14T20:00:00Z",
    "finalized_at": "2026-09-14T20:00:01.400Z",
    "interpretation_policy": "no_automatic_interpretation"
  },
  "response_series": {
    "schema_version": "0.2-draft",
    "series_id": "OBS-SERIES-001",
    "session_id": "OBS-SESSION-001",
    "participant_id": "PSEUDONYM-001",
    "protocol_id": "pg01-geometric-regularity",
    "started_at": "2026-09-14T20:00:00Z",
    "observations": [
      {
        "timestamp_s": 1.3,
        "timing_point": "post_trial",
        "condition_id": null,
        "responses": {
          "confidence": 4
        },
        "status": "participant_reported"
      }
    ],
    "engine_records": [],
    "derived_metrics": [],
    "behavioral_records": [
      {
        "schema_version": "0.2-draft",
        "record_id": "OBS-SESSION-001.pg01-trial-0001.attempt-001",
        "probe_id": "pg01-geometric-regularity",
        "trial_id": "pg01-trial-0001",
        "response_status": "answered",
        "choice_id": "left",
        "reaction_time_ms": 750,
        "recorded_at": "2026-09-14T20:00:01Z",
        "timing_point": "pre_protocol_behavioral",
        "provenance": {
          "runtime_id": "aeon-observation-runtime",
          "runtime_version": "0.1",
          "clock_source": "performance.now",
          "input_modality": "keyboard"
        },
        "timing_trace": {
          "stimulus_onset_ms": 500,
          "response_ms": 1250
        },
        "display_context": {
          "width_px": 1440,
          "height_px": 900,
          "device_pixel_ratio": 1
        },
        "operational_authority": false,
        "integrity": {
          "perceptual_stimulus_integrity": "VALID",
          "response_input_integrity": "VALID",
          "timing_integrity": "VALID",
          "reasons": []
        },
        "evidence_role": "behavioral_measured"
      }
    ],
    "interpretation_boundary": "Behavioral records describe observed choices and timing; they do not diagnose, establish causality, or prove symbolic constructs."
  },
  "journal": [
    {
      "event_schema_version": "0.1-draft",
      "event_id": "40000000-0000-4000-8000-000000000000",
      "session_id": "OBS-SESSION-001",
      "seq": 0,
      "event_type": "session_created",
      "wall_time": "2026-09-14T20:00:00Z",
      "runtime_epoch_id": "11111111-1111-4111-8111-111111111111",
      "performance_time_origin_ms": 1789415990000,
      "monotonic_ms": 10,
      "attempt_id": null,
      "payload": {
        "series_id": "OBS-SERIES-001",
        "participant_id": "PSEUDONYM-001",
        "protocol_id": "pg01-geometric-regularity",
        "created_at": "2026-09-14T20:00:00Z",
        "runtime_id": "aeon-observation-runtime",
        "runtime_version": "0.1",
        "interpretation_policy": "no_automatic_interpretation"
      }
    },
    {
      "event_schema_version": "0.1-draft",
      "event_id": "40000000-0000-4000-8000-000000000001",
      "session_id": "OBS-SESSION-001",
      "seq": 1,
      "event_type": "session_started",
      "wall_time": "2026-09-14T20:00:00Z",
      "runtime_epoch_id": "11111111-1111-4111-8111-111111111111",
      "performance_time_origin_ms": 1789415990000,
      "monotonic_ms": 20,
      "attempt_id": null,
      "payload": {
        "started_at": "2026-09-14T20:00:00Z"
      }
    },
    {
      "event_schema_version": "0.1-draft",
      "event_id": "40000000-0000-4000-8000-000000000002",
      "session_id": "OBS-SESSION-001",
      "seq": 2,
      "event_type": "trial_armed",
      "wall_time": "2026-09-14T20:00:00.100Z",
      "runtime_epoch_id": "11111111-1111-4111-8111-111111111111",
      "performance_time_origin_ms": 1789415990000,
      "monotonic_ms": 100,
      "attempt_id": "22222222-2222-4222-8222-222222222222",
      "payload": {
        "attempt_ordinal": 1,
        "timing_point": "pre_protocol_behavioral",
        "probe_ref": {
          "artifact_type": "behavioral_probe",
          "artifact_id": "pg01-geometric-regularity",
          "sha256": "00be2f58fd8d9c8afe75559f64f4c4f9b61a484b0f07fcc48b1d3bafd4d98b30"
        },
        "trial_ref": {
          "artifact_type": "behavioral_trial",
          "artifact_id": "pg01-trial-0001",
          "sha256": "5804589ffc991d22c0520cc06e1fcd9956d62c7be1e0c36c92d642c1b1e7d98a"
        },
        "stimulus_refs": [
          {
            "artifact_type": "perceptual_stimulus",
            "artifact_id": "pg.regularity.hex.0001",
            "sha256": "221ae529a688d39dd8ab1d71e8c1749bc68044ffae674020fe09705fd632fc6a"
          },
          {
            "artifact_type": "perceptual_stimulus",
            "artifact_id": "pg.regularity.hex.0002",
            "sha256": "a0a4d1179ba37b5acfadbec28f1f37d06d6d3d2581080fd102ed7e40486715f4"
          }
        ]
      }
    },
    {
      "event_schema_version": "0.1-draft",
      "event_id": "40000000-0000-4000-8000-000000000003",
      "session_id": "OBS-SESSION-001",
      "seq": 3,
      "event_type": "stimulus_onset",
      "wall_time": "2026-09-14T20:00:00.500Z",
      "runtime_epoch_id": "11111111-1111-4111-8111-111111111111",
      "performance_time_origin_ms": 1789415990000,
      "monotonic_ms": 500,
      "attempt_id": "22222222-2222-4222-8222-222222222222",
      "payload": {
        "presentation_source": "presentation_adapter",
        "display_context": {
          "width_px": 1440,
          "height_px": 900,
          "device_pixel_ratio": 1,
          "refresh_hz_estimate": 60
        }
      }
    },
    {
      "event_schema_version": "0.1-draft",
      "event_id": "40000000-0000-4000-8000-000000000004",
      "session_id": "OBS-SESSION-001",
      "seq": 4,
      "event_type": "response_captured",
      "wall_time": "2026-09-14T20:00:01.250Z",
      "runtime_epoch_id": "11111111-1111-4111-8111-111111111111",
      "performance_time_origin_ms": 1789415990000,
      "monotonic_ms": 1250,
      "attempt_id": "22222222-2222-4222-8222-222222222222",
      "payload": {
        "choice_id": "left",
        "input_modality": "keyboard"
      }
    },
    {
      "event_schema_version": "0.1-draft",
      "event_id": "40000000-0000-4000-8000-000000000005",
      "session_id": "OBS-SESSION-001",
      "seq": 5,
      "event_type": "behavioral_record_committed",
      "wall_time": "2026-09-14T20:00:01.260Z",
      "runtime_epoch_id": "11111111-1111-4111-8111-111111111111",
      "performance_time_origin_ms": 1789415990000,
      "monotonic_ms": 1260,
      "attempt_id": "22222222-2222-4222-8222-222222222222",
      "payload": {
        "record": {
          "schema_version": "0.2-draft",
          "record_id": "OBS-SESSION-001.pg01-trial-0001.attempt-001",
          "probe_id": "pg01-geometric-regularity",
          "trial_id": "pg01-trial-0001",
          "response_status": "answered",
          "choice_id": "left",
          "reaction_time_ms": 750,
          "recorded_at": "2026-09-14T20:00:01Z",
          "timing_point": "pre_protocol_behavioral",
          "provenance": {
            "runtime_id": "aeon-observation-runtime",
            "runtime_version": "0.1",
            "clock_source": "performance.now",
            "input_modality": "keyboard"
          },
          "timing_trace": {
            "stimulus_onset_ms": 500,
            "response_ms": 1250
          },
          "display_context": {
            "width_px": 1440,
            "height_px": 900,
            "device_pixel_ratio": 1
          },
          "operational_authority": false,
          "integrity": {
            "perceptual_stimulus_integrity": "VALID",
            "response_input_integrity": "VALID",
            "timing_integrity": "VALID",
            "reasons": []
          },
          "evidence_role": "behavioral_measured"
        }
      }
    },
    {
      "event_schema_version": "0.1-draft",
      "event_id": "40000000-0000-4000-8000-000000000006",
      "session_id": "OBS-SESSION-001",
      "seq": 6,
      "event_type": "context_marker_recorded",
      "wall_time": "2026-09-14T20:00:01.270Z",
      "runtime_epoch_id": "11111111-1111-4111-8111-111111111111",
      "performance_time_origin_ms": 1789415990000,
      "monotonic_ms": 1270,
      "attempt_id": "22222222-2222-4222-8222-222222222222",
      "payload": {
        "marker": {
          "marker_schema_version": "0.1-draft",
          "marker_id": "33333333-3333-4333-8333-333333333333",
          "source": "participant",
          "kind": "phenomenological",
          "label": "unexpected_visual_salience",
          "data": {
            "free_text_present": true,
            "intensity_self_rating": 6
          },
          "note": "The participant spontaneously reported that one presentation felt unusually salient.",
          "interpretation_policy": "none_at_capture",
          "projection_policy": "journal_only"
        }
      }
    },
    {
      "event_schema_version": "0.1-draft",
      "event_id": "40000000-0000-4000-8000-000000000007",
      "session_id": "OBS-SESSION-001",
      "seq": 7,
      "event_type": "participant_observation_committed",
      "wall_time": "2026-09-14T20:00:01.300Z",
      "runtime_epoch_id": "11111111-1111-4111-8111-111111111111",
      "performance_time_origin_ms": 1789415990000,
      "monotonic_ms": 1300,
      "attempt_id": null,
      "payload": {
        "observation": {